{"$schema":"./phase-0-14-gate.schema.json","attempts":[{"artifacts":[],"failureStage":"scientific-preflight","horizon":2030,"reasonCodes":["automated-methodology-recommendation-rejected","cell-level-vertical-uncertainty-unbounded","independent-reviews-pending"],"scenario":"ssp1-26","scientificClassValues":[],"statistics":null,"status":"stopped-before-array"},{"artifacts":[],"failureStage":"scientific-preflight","horizon":2050,"reasonCodes":["automated-methodology-recommendation-rejected","cell-level-vertical-uncertainty-unbounded","independent-reviews-pending"],"scenario":"ssp1-26","scientificClassValues":[],"statistics":null,"status":"stopped-before-array"},{"artifacts":[],"failureStage":"scientific-preflight","horizon":2100,"reasonCodes":["automated-methodology-recommendation-rejected","cell-level-vertical-uncertainty-unbounded","independent-reviews-pending"],"scenario":"ssp1-26","scientificClassValues":[],"statistics":null,"status":"stopped-before-array"},{"artifacts":[],"failureStage":"scientific-preflight","horizon":2030,"reasonCodes":["automated-methodology-recommendation-rejected","cell-level-vertical-uncertainty-unbounded","independent-reviews-pending"],"scenario":"ssp2-45","scientificClassValues":[],"statistics":null,"status":"stopped-before-array"},{"artifacts":[],"failureStage":"scientific-preflight","horizon":2050,"reasonCodes":["automated-methodology-recommendation-rejected","cell-level-vertical-uncertainty-unbounded","independent-reviews-pending"],"scenario":"ssp2-45","scientificClassValues":[],"statistics":null,"status":"stopped-before-array"},{"artifacts":[],"failureStage":"scientific-preflight","horizon":2100,"reasonCodes":["automated-methodology-recommendation-rejected","cell-level-vertical-uncertainty-unbounded","independent-reviews-pending"],"scenario":"ssp2-45","scientificClassValues":[],"statistics":null,"status":"stopped-before-array"},{"artifacts":[],"failureStage":"scientific-preflight","horizon":2030,"reasonCodes":["automated-methodology-recommendation-rejected","cell-level-vertical-uncertainty-unbounded","independent-reviews-pending"],"scenario":"ssp5-85","scientificClassValues":[],"statistics":null,"status":"stopped-before-array"},{"artifacts":[],"failureStage":"scientific-preflight","horizon":2050,"reasonCodes":["automated-methodology-recommendation-rejected","cell-level-vertical-uncertainty-unbounded","independent-reviews-pending"],"scenario":"ssp5-85","scientificClassValues":[],"statistics":null,"status":"stopped-before-array"},{"artifacts":[],"failureStage":"scientific-preflight","horizon":2100,"reasonCodes":["automated-methodology-recommendation-rejected","cell-level-vertical-uncertainty-unbounded","independent-reviews-pending"],"scenario":"ssp5-85","scientificClassValues":[],"statistics":null,"status":"stopped-before-array"}],"authoritativeScientificDisposition":"blocked","automatedMethodologyRecommendation":{"authority":"automated-methodology-analysis","disposition":"rejected","status":"complete"},"automation":{"canActAsIndependentReviewer":false,"canApproveScience":false,"status":"passed"},"decisionReason":"Automated analysis recommends rejecting the selected binary coastal-screening methodology because its required cell-level vertical uncertainty cannot be bounded from the pinned evidence. The authoritative scientific disposition remains blocked pending independent review.","deliverables":{"analysisCogs":[],"geoParquet":[],"releaseReceipts":[],"scientificArrays":[],"statistics":[],"visualPmtiles":[]},"dependencyBindings":[{"binding":{"expectedPath":"src/pipeline/science/evidence/geoid-evaluator-validation.json","path":"src/pipeline/science/evidence/geoid-evaluator-validation.json","sha256":"fbbb0de21aa7014fa1673eccd8016d197a78b0cee11d6672263ac16e54aa0660","status":"bound"},"disposition":"blocked","issue":94,"reasonCode":"independent-geoid-validation-pending"},{"binding":{"expectedPath":"src/pipeline/science/coastal-uncertainty-budget.json","path":"src/pipeline/science/coastal-uncertainty-budget.json","sha256":"2916d5f98d8f2b876666c8150a0a9329023d54537361b3ce1dc83b40a12f2a93","status":"bound"},"disposition":"blocked","issue":95,"reasonCode":"cell-level-vertical-uncertainty-unbounded"},{"binding":{"expectedPath":"src/pipeline/science/evidence/phase-0-12-basin-controls.json","path":"src/pipeline/science/evidence/phase-0-12-basin-controls.json","sha256":"7c5552cc568572d2b49d7c379428f3cc8484ce9ca18519445eeab01aa8d34a4e","status":"bound"},"disposition":"blocked","issue":96,"reasonCode":"vertical-goldens-and-review-pending"},{"binding":{"expectedPath":"src/pipeline/science/scope-connectivity-review.json","path":"src/pipeline/science/scope-connectivity-review.json","sha256":"a8914bb2a7a1dc7ddf8b24954cb28153b6c32c4e8d052b75668bb292f2810c8c","status":"bound"},"disposition":"blocked","issue":97,"reasonCode":"independent-scope-connectivity-review-pending"}],"gateId":"phase-0.14-final-scientific-no-go","historicalGateBindings":[{"immutable":true,"path":"src/pipeline/science/phase-0-9-gate.json","sha256":"d52225b0ea7afa7d0a39f2b0ec4687a57b6eb34a6a004884ffff312372c2aced"},{"immutable":true,"path":"src/pipeline/science/evidence/phase-0-9-regional-attempt.json","sha256":"9e158807a36cc5f445f0fecb955975dabb5119496d680063a724b18743524636"}],"issue":98,"phase0Disposition":"complete-with-no-go","phase1":{"reason":"Phase 0 completed with no-go; a newly scoped methodology and gate are required before Phase 1 can begin.","status":"locked","unlocked":false},"recordStatus":"final","recordedAt":"2026-08-05","requiredReviews":{"crossEnvironment":{"evidence":null,"status":"pending"},"dataLicence":{"evidence":null,"status":"pending"},"engineering":{"evidence":null,"status":"pending"},"productScope":{"evidence":null,"status":"pending"},"scientificData":{"evidence":null,"status":"pending"}},"schemaVersion":1,"shortCircuit":{"reasonCodes":["automated-methodology-recommendation-rejected","cell-level-vertical-uncertainty-unbounded","independent-reviews-pending"],"sourcePayloadsOpened":false,"stage":"scientific-preflight","triggerIssue":95}}
